1;1943-1946;Областной земельный отдел
;1947-1953;Областное управление сельского хозяйства
;1953;Областное управление сельского хозяйства и заготовок
;1954-1961;Областное управление сельского хозяйства
;1962-1964;Ростовское областное управление производства и  заготовок продуктов
;1965-1974;Ростовское областное управление сельского хозяйства
;1975-март 1986;Производственное управление сельского хозяйства Ростоблисполкома
;апр1986-1989;Агропромышленный комитет Ростовской области
;1990-март 1992;Союз агропромышленных формирований Ростовской области
;март1992-нояб1996;Департамент сельского хозяйства и продовольствия Администрации Ростовской области
;нояб1996-октяб1998;Министерство сельского хозяйства, продовольствия и торговли Ростовской области
;окт.98;Министерство сельского хозяйства и продовольствия Ростовской области
2;1954-1957;Каменское областное управление сельского хозяйства
3;1928-1944;Управление военно-конными заводами Красной Армии
;1944-1948;Центральное управление военно-конными заводами НКО СССР
;1948-1952;Северо-Кавказский трест конных заводов МСХ
;1952-1953;Центральное управление военно-конными заводами
;1953-1962;Северо-Кавказский трест конных заводов
4;1941-1946;Управление землеустройства Областного земельного отдела
;1947-1955;Управление землеустройства и севооборотов Ростовского областного управления сельского хозяйства
;1956-1957;Отдел землеустройства областного управления сельского хозяйства
;1957-1959;Управление землеустройства областного управления сельского хозяйства
;1960-1961;Отдел землеустройства областного управления сельского хозяйства
5;1950-1953;Областное управление хлопководства
6;1946;Стройплощадка треста Севкавзаготстрой
;1946;Стройдвор треста Севкавзаготстрой
;1947-1951;Ростовский строительный комбинат треста Севкавзаготстрой
;1952-1956;Ростовский строительный комбинат треста Заготстройдеталь
;янв-июль 1957;Ростовский строительный комбинат треста Элеватормельстройдеталь
;авг1957-1961;Ростовский строительный комбинат треста Севкавхлебстрой
;янв-ноябрь 1962;Ростовский стройкомбинат треста Севкавэлеватормельстрой
;дек 1962-1970;Ростовский стройкомбинат треста Спецэлеватормельмаш
7;1943-1946;Областной трест машино-тракторных мастерских и ремонтных заводов Областного земельного отдела
;1947-1951;Областной трест машино-тракторных мастерских и ремон-тных заводов Областного управления сельского хозяйства
;1952-июнь1953;Ростовский областной трест  ремонтных заводов и межрайонных мастерских капитального ремонта Ремтрест Областного управления сельского хозяйства
;июнь 1953-1959;Управление ремонтными предприятиями Областного управления сельского хозяйства
8;1956-1957;Каменское областное управление ремонтными предприятиями
9;март1943-июнь1946;Ростовский трест зерновых и животноводческих совхозов НК СХ СССР
;июнь1946-май1953;Ростовский зернотрест Министерства земледелия СССР, Министерства совхозов СССР 
;май1953-окт1953;Управление совхозов Юга
;окт1953-апр1954;Ростовский трест Южных совхозов Министерства совхозов СССР
10;ноя.53;Северное управление совхозов Ростовской области
;нояб1953-март1954;Ростовский Северный трест совхозов
;апр1954-май1955;Каменский трест совхозов
;июнь1955июль1957;Каменское областное управление совхозов Министерства совхозов РСФСР
11;1972-1975;Ростовский областной сельскохозяйственный информационно- вычислительный центр АСУ-сельхоз Министерства сельского хозяйства РСФСР
;1986-1991;Информационно-вычислительный центр Агропрома Ростовской области
12;1945-1953;Ростовский трест животноводческих совхозов
13;1947-1953;Ростовский овцетрест
;1967-1975;Ростовский трест овцеводческих совхозов
;1975-1983;Ростовский трест Овцепром
14;1959-1962;Ростовский трест овощеводческих совхозов
;1967-1972;Ростовский трест овощеводческих совхозов Ростовского областного производственного объединения совхозов Министерства совхозов РСФСР
;1973-1980;Ростовский трест овощеводческих совхозов Министерства сельского хозяйства РСФСР
;1981-1983;Трест Овощепром Республиканского производственного объединения по производству и сбыту овощей Овощепрома РСФСР Министерства плодоовощного хозяйства РСФСР-документы хранятся  на Советской 55/2
15;сент1961-дек1969;Ростовская землеустроительная экспедиция Республиканского института Росгипрозем
;дек1969-1971;Ростовское отделение Республиканского института Росгипрозем
16;1941-окт1946;Ростовское отделение Всесоюзной конторы Союзмелиострой НКСХ СССР
;окт1946-1948;Ростовская межобластная контора Союзмелиострой Министерства животноводства СССР
;1948-1954;Ростовская межобластная контора по землеустройству Министерства совхозов СССР(землеустроительная контора)
;1955-1961;Ростовская межобластная контора по землеустройству Министерства совхозов РСФСР
;1962-1973;Южный филиал Республиканского проектного института по землеустройству Росгипрозем Министерства производства и заготовок сельхозпродуктов РСФСР
;1974-1981;Южный филиал Республиканского проектного института по землеустройству Росгипрозем Министерства сельского хозяйства РСФСР
;1981-1986;Южный государственный проектный институт по землеустройству Южгипрозем объединения Росземпроект Министерства сельского хозяйства РСФСР
;1986-1992;Южный государственный проектный институт по землеустройству Южгипрозем объединения Росземпроект Госагропрома РСФСР
;1992-2002;Южный государственный научно-исследовательский и проектно-изыскательский институт по землеустройствуЮжНИИгипрозем объединения  РосНИИземпроект Госкомзема РСФСР
;2002-2003;Южный государственный научно-исследовательский и проектно-изыскательский институт по землеустройствуЮжНИИгипрозем объединения РосНИИземпроект Росземкадастра
17;1947-1956;Ростовская сельскохозяйственная школа по подготовке руководящих кадров колхозов
18;1963-1966;Ростовская головная госплемстанция
;1967-1968;Ростовская областная станция по племенной работе и искусственному осеменению сельскохозяйственных животных
;1969-1972;Ростовская областная госплемстанция
19;1954-1973;Ростовская областная сельскохозяйственная выставка
20;1946-1992;Эпизоотический отряд ветеринарного отдела облсельхозуправления см.внимательно опись
21;1943-1986;Ростовская областная ветеринарная лаборатория Ростовского областного управления сельского хозяйства
;1986-1990;Ростовская областная ветеринарная лаборатория Агропромышленного комитета Ростовской области
;1990-1991;Ростовская областная ветеринарная лабораторияРостовоблагропромсоюза
22;1943-1963;Управление водного хозяйства Облисполкома Облводхоз
;1964-1977;Ростовское областное управление мелиорации и водного хозяйства Ростоблисполкома РСФСР Министерства мелиорации и водного хозяйства 
;1978-1988;   Минводхоза РСФСР
23;1943-1978;Ростовская областная контора пчеловодства Ростовского областного управления сельского хозяйства
24;1972-1975;Ростовское областное производственное объединение совхозов Министерства совхозов РСФСР
25;1943-1978;Ростовская областная контора шелководства Российской республиканской конторы по шелководству Росшелк Министерства сельского хозяйства РСФСР
;1979-1996;Ростовское областное управление шелководства
26;февраль-авг 1943;Городской земельный отдел Горисполкома
;авг 1943-1962;Сельхозотдел Горисполкома
;1963-1973;Городская санитарно-ветеринарная станция
;1974-июнь1986;Ростовская-на-Дону Городская санитарно-ветеринарная станция
;июнь1986июнь1999;Городская станция по борьбе с болезнями животных Ростовская
;июнь1999-2004;Государственное учреждение Ростовская городская станция по борьбе с болезнями животных 
27;1950-1966;Ростовская областная контора Зооветснаб
;1966-1980;Ростовское областное объединение ЗооветснабОбластного управления сельского хозяйства
28;1943-1963;Отряд по борьбе с болезнями растений и животных Главного управления защиты растений РСФСР
;1963-2002;Ростовская областная станция защиты растений Ростовского областного управления производства и заготовок сельхозпродуктов см дело фонда
29;1946-1947;Ростовский областной отдел животноводства
30;1947-1966;Ростовский семенозаготовительный участок
;1966-1972;Ростовская  областная контора семеноводства плодовых культур 
;1973-1985;Ростовский плодосеменоводческий госпромхоз
;март1986-нояб1987;Плодосеменоводческий совхоз Ростовский ПО Ростовплодосемпром
;нояб1987-сент1992;Совхоз Ростовский ПО Донсадпитомник 
;сент1992-апр 1998;АОЗТ Росток
;апр1998-2002;ЗАО Росток
31;1946-1947;Ростовский государственный ипподром Центрального управления военных конных заводов
;1948-1958;Ростовский государственный ипподром Северо-Кавказского треста конных заводов
;1959-1966;Ростовский государственный ипподром Ростовского областного управления сельского хозяйства
;1967-1972;Республиканский Ростовский ипподром Главного управления коневодства и коннозаводства МСХ РСФСР 
;1973-2001;Государственное предприятие Ростовский республиканский ипподром Министерства сельского хозяйства и продовольствия Российской федерации 
32;1943-1976;Ростовская государственная инкубаторно-птицеводческая станция
;1986-1991;Цех инкубации Производственного бройлерного объединения Ростовское птицефабрики Дон
;1991;Ростовская инкубаторно-птицеводческая станция
;1992-1993;ООО Ростовский инкубатор
;1994-2003;ТОО Ростовский инкубатор
33;1943-1972;Инспектура госкомиссии по сортоиспытанию сельскохозяйственных культур по Ростовской области
34;1944-1964;Межсовхозная ветбаклаборатория (1943-1952 Министерства совхозов СССР,1953-1954 Министерства совхозов РСФСР),1955-1956 Ростовского областного управления совхозов,1957-1961 Ростовского областного управления сельского хозяйства,1962-1964 Ростовского областного управления производства и заготовок сельскохозяйственных продуктов)
;1964-1967;Ростовская областная производственная лаборатория по изготовлению   препаратов для животноводства (1964-1965Ростовского областного управления производства и заготовок сельскохозяйственных продуктов), 1966-1967 Ростовского областного управления сельского хозяйства 
;1967-1972;Отдел по производству препаратов для животноводства Областного управления сельского хозяйства
;1972-1982;Ростовская областная производственная ветлабораторияРостовского областного управления сельского хозяйства
35;1943-1957;Сальское межрайонное отделение пчеловодства Ростовской областной конторы пчеловодства
;1957-1973;Ростовское межрайонное отделение пчеловодства Ростовской областной конторы пчеловодства
36;1942-1982;Домоуправление Областного управления сельского хозяйства 
37;1943-1947;Ростовская областная контора инкубаторно-птицеводческих станций ОблЗО
;1947-1953;Ростовский областной трест инкубаторно-птицеводческих станций Главного управления ИПС МСХ РСФСР
;1953-1961;Ростовское областное управление птицеводства и инкубатор-но-птицеводческих станций Областного управления сельского хозяйства и заготовок
;1961-1960;Ростовский трест птицеводческих совхозов ИПС Ростовского областного управления совхозов
;1965-1985;Ростовский трест Птицепром Всероссийского производственно-научного объединения птицеводческой промышленности
;1986-1993;Производственное объединение Ростовптицепром по птицеводству
;1994-1996;АО Донптицепром
38;1954-1957;Каменское областное управление птицеводства и инкубаторно- птицеводческих станций
39;1943-1948;Ростовская областная контрольно-семенная лаборатория
;1948-1953;Ростовская областная госинспекция по качеству семян
;1953-1969;Ростовская областная контрольно-семенная лаборатория  
;1969-1991;Ростовская  областная семенная государственная инспекция
40;1946-1953;Батайская госинспекция по семенному контролю
;1961-1969;Батайская контрольно-семенная лаборатория  
;1969-1970;Батайская контрольно семенная  инспекция
41;1943-1947;Ростовская межобластная контора Агролессемпитомник
;1948-1953;Ростовское областное отделение Всесоюзного треста Гослесопитомник
;1954-1956;Ростовский областной трест Гослессемпитомник
;1957-1960;Управление садоводства, плодопитомнических совхозов, пчеловодства и шелководства
;1961-1976;Трест садоводства и плодопитомнических совхозов 
;1977-1986;Объединение Донплодопром
42;1943-1964;Ростовская областная заготовительно-племенная животноводческая контора
;1965-1971;Ростовское областное объединение по заготовкам племенных животных Племживобъединение
;1972;Ростовское областное Госплемобъединение 1971-1972-документов нет
43;1949-1951;Всесоюзный государственный трест по изысканиям и проектированию оросительных систем и гидротехнических сооружений РостовдонводпроектМинистерства сельского хозяйства СССР
;1951-1968;Южный государственный институт  по проектированию водохозяйственного и мелиоративного строительства Южгипроводхоз Министерства сельского хозяйства СССР Министерства сельского хозяйства РСФСР Государственного комитета Совета Министров РСФСР по водному хозяйству Министерства мелиорации и водного хозяйства РСФСР  
;1969-1991;Южный государственный институт  по проектированию водохозяйственного и мелиоративного строительства Министерства мелиорации и водного хозяйства РСФСР  
44;1943-1955;Ростовская межрайонная живконтора
45;1958-1972;Ростовская госстанция искусственного осеменения пос Аглос
46;1949-1951;Промкомбинат Ростовского отделения Союзсовхозснаб
47;1933-1957;Ростовское отделение Союзсовхозсмнаб
48;1944-1947;Ростовская областная контора Сельобозпромснаб
49;1943-1953;Ростовская областная контора Сельхозснаб
50;1944-1949;Молотовская лесозаготовительная контора Сельхозснаб
51;1948-1949;Сталинградская лесоперевалочная база Сельхозснаб
;1951-1956;Сталинградская хозрасчетная лесоперевалочная база Ростовской лесозаготовительной конторы
52;1946-1955;Ростовское отделение Сельхозснаб
53;1956-1958;Ростовское межрайонное отделениеуправления МТС Сельхозснаб
54;1954-1957;Каменская областная контора  МТС Сельхозснаб
55;1952-1958;Константиновская межрайонное отделение  МТС Сельхозснаб
56;1953-1960;Управление материально-технического снабжения Сельхозснаб
57;1943-1947;Ростовская областная контора Глававтотракторосбыт
;1948-1949;Ростовская областная контора Глававтосельмашснаб
;1949-1952;Ростовская областная контора Глававтотракторсбыт
;1953-1954;Ростовская областная контора Главмашсбыт
;1954-1959;Ростовская областная контора Глававтотрактороснабсбыт
;1959-1960;Ростовская областная контора-база Росглававтотрактороснабсбыт
;1960-1961;Ростовская областная специализированная база Главторгмаш
;1961-1977;Ростовская специализированная завозная база Сельхозтехника
58;1960-1961;Ростовское областное управление Главторгмаш
59;1961-1985;Ростовское областное объединение Сельхозтехника
;1986;Ростовское областное производственное объединение по производственно-техническому обеспечению сельского хозяйства Ростоблсельхозтехника
60;1945-1960;Ростовское межрайонное отделение Глававтотракторсбыт
;1960-1961;Специализированные магазины № 1 и № 2 Главторгмаша
;1961-1979;Ростовский городской специализированный магазин № 2 Сельхозтехника
