;1956-1957                                                                                                                                                                                                                                                                                                                                                                                                                                                                                                                                                                                                                                                                                                                                                                                                                                                                                                                                                                                                                                                                                                                                                                                                                                                                                                                                                                                                                                                                                                                                                                                                                                                                                                                                                                                                                                                                                                                                                                                                                                                                                                                                                                                                                                                                                                                                                                                                                                                                                                                                                                                                                                                                                                                                                                                                                                                                                                                                                                                                                                                                                                                                                                                                                                                                                                                                                                                                                                                                                                                                                                                                                                                                                                                                                                                                                                                                                                                                                                                                                                                                                                                                                                                                                                                                                                                                                                                                                                                                                                                                                                                                                                                                                                                                                                                                                                                                                                                                                                                                                                                                                                                                                                                                                                                                                                                                                                                                                                                                                                                                                                                                                                                                                                                                                                                                                                                                                                                                                                                                                                                                                                                                                                                                                                                        ;Машино-прокатная база треста Севкавхлебстрой
;1958-1961;Управление механизации и специализированных работ треста Севкавхлебстрой
;1961-1963;Управление механизации и специализированных работ  треста Севкавзаготстрой
;1964;Управление механизации треста Севкавэлеватормельстрой
;1965-1979;Управление механизации треста Севкавэлеваторстрой 
;1980-1988;Управление механизации № 1 треста Севкавэлеваторстрой
;1989-1993;Управление механизации № 1 ППСО СКЭСС
;1992-1998;ТОО СЭМПУС
;1999-2003;ООО СЭМПУС
187;1943-1959;Комбинат № 1 Горплодовощторга
;1959-1963;Оптовая плодоовощная база № 2,3,Холодильник Горплодоовощторга
;1964-1986;База № 2 ОРО Плодоовощ
;1986-1994;База № 2 ГПОТ Ростовский
;1994-1996;АООТ Плодоовощ-2
;1996-2002;ОАО Плодоовощ-2 
188;1972-1975;Лаборатория стандартизации и метрологии Областного объединения Сельхозтехника
189;1968-;Миллеровский строительно-монтажный участок Миллеровского леспромхоза 
;;Управления лесозаготовок Ростоблколхозстроя
;1969-1979;Миллеровский строительно-монтажный участок Управления лесозаготовок Ростоблколхозстроя
190;1975-1979;Механизированный отряд по борьбе с вредителями сельскохозяйственных культур 
;;Ростовской областной станции защиты растений
191;1966-1970;Группа технического надзора по строительству в колхозах Областного управления сельского хозяйства
;1971-1986;Управление капитального строительства в колхозах  Областного управления сельского хозяйства
192;1952-1954;Ростовский строительный участок треста Ростовсовхозводстрой
;1955-1956;Ростовский строительно монтажный участок треста Ростовсовхозводстрой
;1956-1966;Ростовский прорабский участок треста Ростовсельхозводстрой
193;1951-1954;Ростовская контора материально-технического снабжениятреста Ростовсовхозводстрой
;1954-1956;Транспортная контора треста Ростовсовхозводстрой
;1967-1975;Хозрасчетная контора материально-технического снабжениятреста Ростовсельхозводстрой
;1976-1985;Управление производственно-технологической комплектации треста Ростовсельхозводстрой УПТК
194;1973-1981 1984;Специализированный ремонтно- строительный трест Ростовводремстрой Республиканского производственного водохозяйственного ремонтно-строительного объединения Росводремстрой Министерства мелиорации и водного хозяйства
195;1952-окт1953;Челябинский филиал Центрального бюро технической помощи строительству Министерства строительства предприятий тяжелой индустрии СССР
;Окт1953-дек1955;Уральский филиал государственного института «Оргстрой»
;Дек1956-1961;Уральский филиал Центрального бюро «Оргстрой» Академии строительства и архитектуры СССР
;1962-1975;Уральский филиал Государственного проектного института по организации сельского строительства и оказанию технической помощи «Гипрооргсельстрой»
;1976-янв 1977;Уральский филиал института «Роспроектсельстройиндустрия»
196;1963-1966;Проектно-сметное бюро Ростовского областного объединения Сельхозтехника 
;1967-1969;Проектно-конструкторское бюро Ростовского областного объединения Сельхозтехника
;1970-1985;Проектная контора Ростовсельхозтехпроект при Ростовском областном объединении Сельхозтехника док-ты с 1980г
;1986-1990;Проектная контора Ростовагропромтехпроект
;1991-1995;Проектный и проектно-технологический институт Ростовагропромтехпроект
;1995-1996;АООТ Проектно-технологический институт Ростовагропромтехпроект
;1996-2001;ОАО Проектно-технологический институт Ростоагропромтехпроект
197;1960-1961;Механические мастерские Ростовского СМУ треста Спецэлеватормельстрой
;1962-1969;Механические мастерские Ростовского СМУ треста Спецэлеватормельмонтаж
198;1968-1986;Спецпоезд Э-19 треста Севкавэлеваторстрой
;1987-1992;Э-7 ППСО Севкавэлеваторспецстрой
;1993-1995;ТОО Сандор
199;1972-1975;Управление производственно-технологической комплектации треста Ростовсельхозмонтаж
;1975-1976;Ново-Аксайское специализированное отделение треста Ростовсельхозмонтаж
;1977-1986;Ново-Ростовское специализированное отделение объединения Ростовсельхозмонтажкомплект
;1986-1992;Ремонтно техническое предприятие Ростовспецмонтажзаготовка
;1992-1997;ОАО Ново-Ростовское
200;1972-1975;Багаевский прорабский хозрасчетный участок по механизации животноводческих ферм треста Ростовсельхозмонтаж 
;1976-1982;Багаевский прорабский хозрасчетный участок по механизации животноводческих ферм объединения Ростовсельхозмонтажкомплект
201;1976-1977;Ростовский хозрасчетный прорабский участок по электромонтажным работам объединения Ростовсельхозмонтажкомплект
;1977-1987;Ростовская передвижная механизированная колонна  по электромонтажным работам объединения Ростовсельхозмонтажкомплект
;1987-1992;Специализированная передвижная механизированная колонна  Ростовская № 2 по электромонтажным работам объединенияРостовсельхозмонтажкомплект
;1993-1998;ТОО Специализированная передвижная механизированная колонна  Ростовская № 2 по электромонтажным работам
202;1970-1983;Ростовский трест свиноводческих совхозов Свинопром Всероссийского производственного научного объединения по свиноводству Свинопром РСФСР Министерства сельского хозяйства РСФСР
203;1977-1983;Ростовское областное межхозяйственное объединение Донконепром Всероссийского объединения конных заводов Министерства сельского хозяйства РСФСР
204;1976-1983;Объединенная дирекция строящихся комплексов в совхозах Ростовского треста Овцепром 
205;1973-1983;Объединенная дирекция строящихся животноводческих комплексов Ростовского объединения Ростовскотопром 
206;1974-1983;Дирекция строящихся свинокомплексовРостовского треста Свинопром
207;1972-1983;Ростовское специализированное управление монтажных и пусконаладочных работ при Ростовском областном объединении Сельхозтехника
208;1943-1962;Колхоз им.Ленина,колхоз им.26-ти Бакинских комиссаров-1книга 
;1962-1972;Совхоз Мясниковский
;1972-1978;Совхоз Ливенцовский
209;1962-1963;Ростовский хозрасчетный участок монтажно-наладочного управления треста Спецэлеватормельстрой Спецэлеватормельмонтаж
;1964-1974;Ростовское монтажно-наладочное управление треста Спецэлеватормельмонтаж 
;1974-1986;Ростовское монтажно-наладочное управление треста Нечерноземэлеватормельмонтаж
;1986-1988;Ростовское специализированное монтажно-наладочное управление треста Центрэлеватормельмонтаж 
;1988-1993;Ростовское специализированное монтажно-наладочное управление треста Спецэлеватормельмонтаж
;1994;Ростовское специализированное монтажно-наладочное управление АООТ Спецэлеватормельмонтаж
;1995-2002;Ростовский филиал АООТ Спецэлеватормельмонтаж
;2003-2008;Ростовское  СМНУ АООТ Спецэлеватормельмонтаж
210;1967-1982;Строительный трест № 4 Ростоблколхозстроя
211;1964-1968;Ростовский н/Д трест консервной промышленности
;1969-1976;Ростовское производственно-совхозное объединение консервной промышленности Донконсерв
;1977-1979;Ростовское производственно-аграрное объединение консервной промышленности Донконсерв
;1981-1984;Ростовское производственное аграрно-промышленное объеди нение консервной промышленности Ростовконсервпром
212;1977-1987;Трест Донтрансводстрой объединения Донводстрой
213;1955-1962;Строительное управление № 8 треста Ростовстрой, Каменскстрой в 1957г
;1962;Строительный участок  № 8 треста Ростовстрой 
214;1950-1952;Зверевский строительный участок Ростовской строительно-монтажной конторы Совхозстрой
;1952;Шахтинское строительное управление треста Союзсовхозстрой, Южного строительного треста 
215;1956-1958;Шахтинское строительное управление № 4 Каменскстроя 
216;1946-1948;Больше-Крепинский строительный участок треста Ростоблсельстрой
;1948-1951;Родионово-Несветайский строительный участок треста Ростоблсельстрой
;1952-1953;Строительная контора № 4 Ростоблсельстроя
217;1949-1951;Аксайский строительный участок № 3 Ростоблсельстроя
218;1965-1977;Контрольно производственная химико-бактериологическая лаборатория Ростовского производственно-совхозного объединения консервной промышленности Донконсерв
219;1977-1979;Хозрасчетный участок Спецстроймонтаж треста Спецстроймонтаж
;1979-1986;Специализированная передвижная механизированная колонна Ростоблколхозстроя
;1986-1996;Специализированная межхозяйственная передвижная механизированная колонна № 8 Ростовагропромстроя
;1996-2002;ОАО СПМК-8 Ростовагропромстроя 
220;1977-1979;Ростовский участок производственно-технологической комп-лектации Ростовского областного межхозяйственного энергетического объединения Сельхозэнерго
;1979-1986;Ростовское управление производственно- технологической комплектации Ростовского областного межхозяйственного энергетического объединения Сельхозэнерго 
;1986-1993;Производственное межхозяйственное предприятие Ростовагропромтехэнерго
221;1972-1977;Автотранспортная контора треста Промжилводстрой
;1978-1980;Автотранспортное предприятие 7 треста Донтрансводстрой
222;1957-1968;Дирекция строящихся рисовых государственных  оросительных систем в Ростовской области Минводхоза РСФСР/Дирекция Ростовдонводстрой/
;1968-1970;Дирекция строящихся рисовых совхозов и оросительных систем в Ростовской области Минводхоза РСФСР/Дирекция Донводстрой/
;1970-1981;Дирекция строящихся рисовых совхозов и оросительных систем Управления мелиорации и водного хозяйства Ростоблисполкома /Дирекция Донводстрой/
223;1974-1981;Дирекция Донсовхозводстрой Управления мелиорации и водного хозяйства Ростоблисполкома
;1981-1994;Дирекция строящихся совхозов и мелиоративных объектов в Ростовской области /Дирекция Ростовсовхозводстрой/
;1994-1997;Государственное предприятие Дирекция строящихся сельскохозяйственных и мелиоративных объектов в Ростовской области /Дирекция Ростовсельхозводстрой/ документы сданы по 1996год включительно
;1997-2003;Государственное учреждение /Государственный заказчик/Дирекция строящихся сельскохозяйственных и мелиоративных объектов в Ростовской области
;;/Дирекция Ростовсельхозводстрой/
;2003-2004;Федеральное Государственное учреждение Дирекция строящихся сельскохозяйственных и мелиоративных объектов в Ростовской области
;;/Дирекция Ростовсельхозводстрой/
224;1970-1981;Дирекция Донгидрострой
225;1980-1985;Белокалитвинский учебно-курсовой комбинат Управления сельского хозяйства 
226;1970-1975;Дирекция строительства Шахтинского завода ЖБИ и других производственных объектов в Ростовской области Главдонводстроя 
;1976-1990;Дирекция по строительству производственных объектов объединения Донводстрой
227;1944,1957-1958;Кавспиртотрест, Ростовский консервно-водочный трест Управления пищевой промышленности
228;1976-1981;Производственное бройлерное объединение Ростовское Птицепрома РСФСР треста Птицепром
;1982-1986;Производственное бройлерное объединение Ростовскоетреста Птицепром
229;1977-1985;Семикаракорский учебно- курсовой комбинат при Производственном управлении сельского хозяйства Семикаракорского райисполкома
230;1973-1980;Ростовская республиканская перевалочная база ветснабжения Ростовского областного объединения Зооветснаб 
231;1974-1983;Ростовский филиал Центра НОТ иУправления производством Госкомсельхозтехники РСФСР
232;1977-1983;Бюро научно-технической информации Сельхозтехника 
233;1976-1986;Ростовское областное производственное объединение Донсемовощ
234;1980-1986;Производственное объединение Ростовское по семеноводству трав
235;1945-1992 ;Госинспекция по закупкам и качеству сельскохозяйственных продуктов по Ростовской области см.оп 1-Л, 2-Л, лаборатория Госхлебинспекции 1980 -1992 гг см.оп 2Л
